{
  "meta": {
    "dataset": "Belgische payroll loonmotor",
    "pc": "200",
    "pc_naam": "Aanvullend Paritair Comité voor Bedienden (APCB)",
    "land": "BE",
    "taal": "nl-BE",
    "laatste_update": "2026-05-30",
    "doeljaar": 2026,
    "datapunten_aantal": 71,
    "dekking": [
      "brutolonen",
      "rsz",
      "fiscaliteit",
      "premies_en_voordelen",
      "arbeidsvoorwaarden"
    ],
    "niet_gevonden": [
      "Volledige bedrijfsvoorheffingsschalen 2026 in machineleesbare tabelvorm (enkel KB-tekst en sleutelformule beschikbaar)",
      "Sectorale verplichting maaltijdcheques in PC 200 (geen sectorale cao gevonden die maaltijdcheques verplicht maakt)",
      "Sectorale verplichting thuiswerkvergoeding PC 200",
      "Volledige tekst centenindex-regelgeving 2026 (regelgeving niet tijdig gefinaliseerd)"
    ],
    "conflicten": [],
    "opmerkingen": [
      "Sectorakkoord PC 200 voor 2025-2026 afgesloten op 15 januari 2026 door sociale partners; bevestigd door sfonds200.be",
      "Bedrijfsvoorheffingsregels 2026 gepubliceerd via KB 11/12/2025 in BS 29/12/2025 (Bijlage III)",
      "Volledige sectorale baremamatrix PC 200 (Schaal I, Schaal II, studenten × Cat A/B/C/D) opgenomen vanaf 2026-05-08; primaire bron SSN (Tier 2), getrianguleerd met ACV en ACLVB (Tier 3) — alle 228 cellen onderling bevestigd",
      "Payroll-expertreview 2026-05-30: de vroegere bouw-subsetbijdrage aanvullend pensioen wordt niet langer als aparte runtimekost berekend; de werkgevers-RSZ blijft een globale raming en het bouwrecord blijft alleen als reviewspoor buiten runtime.",
      "Sociaal Fonds 200 werkgeversbijdrage (0,23%) verlengd voor 1/1/2026–31/12/2027; bevestigd via sfonds200.be op 2026-05-24, met Partena Professional, Liantis en CLB Group als triangulatie",
      "Aanvullende gemeentebelasting: geen Tier-1 machine-leesbare lijst per gemeente beschikbaar; behandeld als UI-parameter (default 7,3%) met disclaimer — niet opgenomen als dataset-datapunt"
    ]
  },
  "lonen": [
    {
      "id": "lonen_pc200_schaalI_catA_01012026",
      "categorie": "lonen",
      "subcategorie": "barema_schaal_I",
      "type": "barema",
      "pc": "200",
      "omschrijving": "Sectorale minimum maandlonen PC 200 – Schaal I (eerste jaar in de onderneming), Categorie A, voltijds (38u/week) – volledige tabel per ervaringsjaar",
      "waarde_bron": "Tabel ervaring → maandloon EUR (zie tabel_per_ervaring); min 2242.81 EUR, max 2459.89 EUR",
      "waarde_genormaliseerd": null,
      "tabel_per_ervaring": [
        {
          "ervaring_jaren": 0,
          "maandloon_eur": 2242.81
        },
        {
          "ervaring_jaren": 1,
          "maandloon_eur": 2249.57
        },
        {
          "ervaring_jaren": 2,
          "maandloon_eur": 2256.28
        },
        {
          "ervaring_jaren": 3,
          "maandloon_eur": 2263.06
        },
        {
          "ervaring_jaren": 4,
          "maandloon_eur": 2269.9
        },
        {
          "ervaring_jaren": 5,
          "maandloon_eur": 2276.51
        },
        {
          "ervaring_jaren": 6,
          "maandloon_eur": 2283.27
        },
        {
          "ervaring_jaren": 7,
          "maandloon_eur": 2289.96
        },
        {
          "ervaring_jaren": 8,
          "maandloon_eur": 2297.16
        },
        {
          "ervaring_jaren": 9,
          "maandloon_eur": 2315.8
        },
        {
          "ervaring_jaren": 10,
          "maandloon_eur": 2334.52
        },
        {
          "ervaring_jaren": 11,
          "maandloon_eur": 2350.42
        },
        {
          "ervaring_jaren": 12,
          "maandloon_eur": 2366.19
        },
        {
          "ervaring_jaren": 13,
          "maandloon_eur": 2382.16
        },
        {
          "ervaring_jaren": 14,
          "maandloon_eur": 2397.8
        },
        {
          "ervaring_jaren": 15,
          "maandloon_eur": 2413.37
        },
        {
          "ervaring_jaren": 16,
          "maandloon_eur": 2428.84
        },
        {
          "ervaring_jaren": 17,
          "maandloon_eur": 2444.35
        },
        {
          "ervaring_jaren": 18,
          "maandloon_eur": 2459.89
        },
        {
          "ervaring_jaren": 19,
          "maandloon_eur": 2459.89
        },
        {
          "ervaring_jaren": 20,
          "maandloon_eur": 2459.89
        },
        {
          "ervaring_jaren": 21,
          "maandloon_eur": 2459.89
        },
        {
          "ervaring_jaren": 22,
          "maandloon_eur": 2459.89
        },
        {
          "ervaring_jaren": 23,
          "maandloon_eur": 2459.89
        },
        {
          "ervaring_jaren": 24,
          "maandloon_eur": 2459.89
        },
        {
          "ervaring_jaren": 25,
          "maandloon_eur": 2459.89
        },
        {
          "ervaring_jaren": 26,
          "maandloon_eur": 2459.89
        }
      ],
      "eenheid": "EUR/maand",
      "valuta": "EUR",
      "frequentie": "maandelijks",
      "berekeningsbasis": "voltijds maandloon (38u/week)",
      "toepassingsgebied": [
        "bedienden PC 200",
        "schaal I",
        "categorie A",
        "ervaring 0–26 jaar"
      ],
      "voorwaarden": [
        "voltijdse tewerkstelling (pro rata bij deeltijds)",
        "functie ingedeeld in categorie A",
        "tijdens het eerste jaar van tewerkstelling in de onderneming (schaal I)"
      ],
      "uitsluitingen": [
        "studenten (eigen schaal van toepassing)",
        "handelsvertegenwoordigers met variabel loon (eigen GMMI-regeling)"
      ],
      "geldig_vanaf": "2026-01-01",
      "geldig_tot": null,
      "laatst_bevestigd_op": "2026-05-08",
      "bron_organisatie": "SSN (sociaal secretariaat) – publicatie sectorbarema PC 200",
      "bron_type": "sociaal_secretariaat",
      "bron_titel": "BAREMA PC 200 Aanvullend Paritair Comité voor de bedienden – 01/2026",
      "bron_url": "https://www.ssn.be/sites/default/files/barema_200_01-2026_nl.pdf",
      "bron_publicatiedatum": "2026-01-01",
      "bron_vindplaats": "Sectie 'Schaal I (eerste jaar in de onderneming)', kolom 'CAT. A maandloon', regels ervaring 0–26",
      "bron_fragment": "CAT. A maandloon, ervaring 0: 2242.81 … ervaring 26: 2459.89",
      "betrouwbaarheid": "Tier 2",
      "extractie_methode": "tabel_extractie",
      "normalisatie_toegepast": true,
      "normalisatie_opmerking": "Komma-decimaal naar punt-decimaal; tabel gestructureerd als lijst van {ervaring_jaren, maandloon_eur}",
      "triangulatie_bronnen": [
        {
          "bron": "ACV / ACVBIE PC200 januari 2026 brochure",
          "url": "https://www.hetacv.be/docs/default-source/acvbie-cscbie-document/sectoraal-sectoriel/aanvullend-bedienden-pc200/kroniek-pc200-lonen-01012026-ndl-lr.pdf",
          "tier": "Tier 3",
          "overeenstemming": "100%"
        },
        {
          "bron": "ACLVB PC200 januari 2026 schaallonen",
          "url": "https://www.aclvb.be/sites/default/files/aclvb/2026_loonbaremas_pc_200_nl.pdf",
          "tier": "Tier 3",
          "overeenstemming": "100%"
        }
      ],
      "status": "actief",
      "conflict_opmerking": null,
      "opmerkingen": [
        "Bedragen omvatten reeds de sectorale indexering van +2,21% per 1/1/2026",
        "Loonplafond per categorie A: vlak na 18 jaar ervaring (€2.459,89 in schaal I; €2.526,16 in schaal II)",
        "Categorieën B/C/D blijven geleidelijk evolueren tot 26 jaar ervaring",
        "Drie onafhankelijke bronnen (SSN, ACV, ACLVB) geven identieke bedragen; OCR-noise in SSN-PDF (jaar 2 cat D, schaal II jaar 13 cat A) gecorrigeerd via Tier 3 triangulatie"
      ]
    },
    {
      "id": "lonen_pc200_schaalI_catB_01012026",
      "categorie": "lonen",
      "subcategorie": "barema_schaal_I",
      "type": "barema",
      "pc": "200",
      "omschrijving": "Sectorale minimum maandlonen PC 200 – Schaal I (eerste jaar in de onderneming), Categorie B, voltijds (38u/week) – volledige tabel per ervaringsjaar",
      "waarde_bron": "Tabel ervaring → maandloon EUR (zie tabel_per_ervaring); min 2336.25 EUR, max 2820.99 EUR",
      "waarde_genormaliseerd": null,
      "tabel_per_ervaring": [
        {
          "ervaring_jaren": 0,
          "maandloon_eur": 2336.25
        },
        {
          "ervaring_jaren": 1,
          "maandloon_eur": 2349.64
        },
        {
          "ervaring_jaren": 2,
          "maandloon_eur": 2363.08
        },
        {
          "ervaring_jaren": 3,
          "maandloon_eur": 2376.61
        },
        {
          "ervaring_jaren": 4,
          "maandloon_eur": 2394.83
        },
        {
          "ervaring_jaren": 5,
          "maandloon_eur": 2413.37
        },
        {
          "ervaring_jaren": 6,
          "maandloon_eur": 2427.38
        },
        {
          "ervaring_jaren": 7,
          "maandloon_eur": 2462.42
        },
        {
          "ervaring_jaren": 8,
          "maandloon_eur": 2497.56
        },
        {
          "ervaring_jaren": 9,
          "maandloon_eur": 2532.54
        },
        {
          "ervaring_jaren": 10,
          "maandloon_eur": 2567.8
        },
        {
          "ervaring_jaren": 11,
          "maandloon_eur": 2597.46
        },
        {
          "ervaring_jaren": 12,
          "maandloon_eur": 2626.81
        },
        {
          "ervaring_jaren": 13,
          "maandloon_eur": 2656.48
        },
        {
          "ervaring_jaren": 14,
          "maandloon_eur": 2685.87
        },
        {
          "ervaring_jaren": 15,
          "maandloon_eur": 2715.45
        },
        {
          "ervaring_jaren": 16,
          "maandloon_eur": 2725.03
        },
        {
          "ervaring_jaren": 17,
          "maandloon_eur": 2734.55
        },
        {
          "ervaring_jaren": 18,
          "maandloon_eur": 2744.25
        },
        {
          "ervaring_jaren": 19,
          "maandloon_eur": 2753.78
        },
        {
          "ervaring_jaren": 20,
          "maandloon_eur": 2763.42